{
  "schema": "plan/v1",
  "listing_id": "87977241",
  "source_image": "data/golden/media/87977241/floorplan_008.png",
  "image_size_px": [
    1447,
    2000
  ],
  "method": "raster_vectorise/v2",
  "preprocess": {
    "deskew_deg": 0.0,
    "binarise": "modal-background distance",
    "upscaled_to_px": 2400,
    "wall_half_px": 26.5,
    "text_components_erased": 166
  },
  "px_per_metre": 153.652,
  "scale_source": "printed_dimensions",
  "scale_candidates": [
    {
      "source": "printed_dimensions",
      "px_per_metre": 153.652,
      "weight": 3.186,
      "detail": "4 room(s), spread 20%"
    },
    {
      "source": "printed_area",
      "px_per_metre": 142.3792,
      "weight": 2.5,
      "detail": "62.4 m\u00b2 over 1265570 px\u00b2"
    },
    {
      "source": "stated_area",
      "px_per_metre": 142.872,
      "weight": 1.5,
      "detail": "62.0 m\u00b2 over 1265570 px\u00b2"
    }
  ],
  "rooms": [
    {
      "room_id": "p0",
      "label": "kitchen",
      "label_text": "KITCHEN",
      "label_confidence": 0.895,
      "polygon_px": [
        [
          365.0,
          205.5
        ],
        [
          367.0,
          265.0
        ],
        [
          369.5,
          206.0
        ],
        [
          737.0,
          206.0
        ],
        [
          737.0,
          460.0
        ],
        [
          876.0,
          463.0
        ],
        [
          829.0,
          548.0
        ],
        [
          677.0,
          610.0
        ],
        [
          736.5,
          611.5
        ],
        [
          736.5,
          821.0
        ],
        [
          605.0,
          821.0
        ],
        [
          598.0,
          704.0
        ],
        [
          530.0,
          735.0
        ],
        [
          474.0,
          821.0
        ],
        [
          472.0,
          699.0
        ],
        [
          391.5,
          699.0
        ],
        [
          391.0,
          821.0
        ],
        [
          367.0,
          761.0
        ],
        [
          365.5,
          820.5
        ],
        [
          267.0,
          820.5
        ],
        [
          267.0,
          307.0
        ],
        [
          289.0,
          282.0
        ],
        [
          278.5,
          205.5
        ]
      ],
      "polygon_m": [
        [
          0.807,
          9.7265
        ],
        [
          0.82,
          9.3393
        ],
        [
          0.8363,
          9.7233
        ],
        [
          3.2281,
          9.7233
        ],
        [
          3.2281,
          8.0702
        ],
        [
          4.1327,
          8.0507
        ],
        [
          3.8268,
          7.4975
        ],
        [
          2.8376,
          7.094
        ],
        [
          3.2248,
          7.0842
        ],
        [
          3.2248,
          5.7207
        ],
        [
          2.369,
          5.7207
        ],
        [
          2.3234,
          6.4822
        ],
        [
          1.8809,
          6.2804
        ],
        [
          1.5164,
          5.7207
        ],
        [
          1.5034,
          6.5147
        ],
        [
          0.9795,
          6.5147
        ],
        [
          0.9762,
          5.7207
        ],
        [
          0.82,
          6.1112
        ],
        [
          0.8103,
          5.724
        ],
        [
          0.1692,
          5.724
        ],
        [
          0.1692,
          9.0659
        ],
        [
          0.3124,
          9.2286
        ],
        [
          0.2441,
          9.7265
        ]
      ],
      "area_px": 277770.62,
      "area_m2": 11.765,
      "ocr_area_m2": null,
      "ocr_dims_m": [
        3.96,
        3.66
      ],
      "centroid_px": [
        515.93,
        495.68
      ],
      "centroid_m": [
        1.7893,
        7.838
      ],
      "extent_m": [
        4.006,
        3.964
      ],
      "aperture_ids": [],
      "confidence": 0.989,
      "qa_flags": [],
      "edited_by_human": false
    },
    {
      "room_id": "p1",
      "label": "reception",
      "label_text": "RECEPTION",
      "label_confidence": 0.91,
      "polygon_px": [
        [
          1003.0,
          206.0
        ],
        [
          1006.0,
          264.0
        ],
        [
          1007.0,
          206.0
        ],
        [
          1271.0,
          206.0
        ],
        [
          1271.0,
          428.5
        ],
        [
          1233.5,
          428.5
        ],
        [
          1233.5,
          461.5
        ],
        [
          766.5,
          461.5
        ],
        [
          766.5,
          206.0
        ]
      ],
      "polygon_m": [
        [
          4.9593,
          9.7233
        ],
        [
          4.9788,
          9.3458
        ],
        [
          4.9853,
          9.7233
        ],
        [
          6.7035,
          9.7233
        ],
        [
          6.7035,
          8.2752
        ],
        [
          6.4594,
          8.2752
        ],
        [
          6.4594,
          8.0604
        ],
        [
          3.4201,
          8.0604
        ],
        [
          3.4201,
          9.7233
        ]
      ],
      "area_px": 127546.25,
      "area_m2": 5.402,
      "ocr_area_m2": null,
      "ocr_dims_m": null,
      "centroid_px": [
        1016.5,
        332.77
      ],
      "centroid_m": [
        5.0471,
        8.8982
      ],
      "extent_m": [
        3.283,
        1.663
      ],
      "aperture_ids": [
        "a0"
      ],
      "confidence": 0.841,
      "qa_flags": [],
      "edited_by_human": false
    },
    {
      "room_id": "p2",
      "label": "dining_room",
      "label_text": "DINING",
      "label_confidence": 0.938,
      "polygon_px": [
        [
          1271.0,
          607.5
        ],
        [
          1212.0,
          610.0
        ],
        [
          1271.0,
          611.0
        ],
        [
          1271.0,
          821.0
        ],
        [
          1006.5,
          821.0
        ],
        [
          1005.0,
          761.0
        ],
        [
          1002.5,
          821.0
        ],
        [
          766.0,
          821.0
        ],
        [
          766.0,
          610.5
        ],
        [
          824.0,
          609.0
        ],
        [
          766.0,
          607.0
        ],
        [
          766.0,
          574.0
        ],
        [
          844.0,
          542.0
        ],
        [
          880.0,
          469.0
        ],
        [
          1239.0,
          469.0
        ],
        [
          1239.0,
          431.0
        ],
        [
          1271.0,
          431.0
        ]
      ],
      "polygon_m": [
        [
          6.7035,
          7.1102
        ],
        [
          6.3195,
          7.094
        ],
        [
          6.7035,
          7.0874
        ],
        [
          6.7035,
          5.7207
        ],
        [
          4.982,
          5.7207
        ],
        [
          4.9723,
          6.1112
        ],
        [
          4.956,
          5.7207
        ],
        [
          3.4168,
          5.7207
        ],
        [
          3.4168,
          7.0907
        ],
        [
          3.7943,
          7.1005
        ],
        [
          3.4168,
          7.1135
        ],
        [
          3.4168,
          7.3282
        ],
        [
          3.9245,
          7.5365
        ],
        [
          4.1587,
          8.0116
        ],
        [
          6.4952,
          8.0116
        ],
        [
          6.4952,
          8.2589
        ],
        [
          6.7035,
          8.2589
        ]
      ],
      "area_px": 170395.25,
      "area_m2": 7.217,
      "ocr_area_m2": null,
      "ocr_dims_m": [
        3.99,
        3.3
      ],
      "centroid_px": [
        1030.24,
        650.05
      ],
      "centroid_m": [
        5.1366,
        6.8333
      ],
      "extent_m": [
        3.287,
        2.538
      ],
      "aperture_ids": [
        "a0"
      ],
      "confidence": 0.994,
      "qa_flags": [
        "room_area_disagrees_with_printed"
      ],
      "edited_by_human": false
    },
    {
      "room_id": "p3",
      "label": "bedroom",
      "label_text": "BEDROOM",
      "label_confidence": 0.903,
      "polygon_px": [
        [
          1003.0,
          850.0
        ],
        [
          1006.0,
          908.0
        ],
        [
          1007.0,
          850.0
        ],
        [
          1271.0,
          850.0
        ],
        [
          1271.0,
          1022.5
        ],
        [
          1212.0,
          1024.0
        ],
        [
          1271.5,
          1026.5
        ],
        [
          1271.5,
          1248.0
        ],
        [
          1006.5,
          1248.0
        ],
        [
          1005.0,
          1188.0
        ],
        [
          1002.5,
          1239.0
        ],
        [
          905.5,
          1239.0
        ],
        [
          905.5,
          1248.0
        ],
        [
          649.0,
          1248.0
        ],
        [
          765.0,
          1233.0
        ],
        [
          727.0,
          1155.0
        ],
        [
          649.0,
          1139.5
        ],
        [
          649.0,
          1026.5
        ],
        [
          708.0,
          1024.0
        ],
        [
          649.0,
          1022.5
        ],
        [
          649.0,
          850.0
        ]
      ],
      "polygon_m": [
        [
          4.9593,
          5.532
        ],
        [
          4.9788,
          5.1545
        ],
        [
          4.9853,
          5.532
        ],
        [
          6.7035,
          5.532
        ],
        [
          6.7035,
          4.4093
        ],
        [
          6.3195,
          4.3996
        ],
        [
          6.7067,
          4.3833
        ],
        [
          6.7067,
          2.9417
        ],